,Rank,Conference,Short Name,H5-Index
852,853,Procedia CS,,15.00
853,854,Teleoperators and Virtual Environments,Presence,15.00
854,855,International Journal of Technology Management,IJTM,15.00
855,856,Computer Science - R&D,,15.00
856,857,Journal of Intelligent Information Systems,J. Intell. Inf. Syst.,15.00
857,858,Journal of Ambient Intelligence and Smart Environments,JAISE,15.00
858,859,Logic Journal of the IGPL,,15.00
859,860,AI Communications,AI Commun.,15.00
860,861,Cognitive Processing,COGN PROCESS,15.00
861,862,Neuroinformatics,,15.00
862,863,Advanced Robotics,,15.00
863,864,International Journal of Computer Integrated Manufacturing,Int. J. Computer Integrated Manufacturing,15.00
864,865,Future Internet,,15.00
865,866,Journal of Nonlinear Science,J. Nonlinear Science,15.00
866,867,International Journal of High Performance Computing Applications,IJHPCA,15.00
867,868,Encyclopedia of Cryptography and Security (2nd Ed.),,15.00
868,869,Information Economics and Policy,IEPOL,14.00
869,870,Applied Artificial Intelligence,AAI,14.00
870,871,Scientific Programming,SP,14.00
871,872,Neural Processing Letters,NPL,14.00
872,873,Information Technology and Management,ITM,14.00
873,874,Human Computer Interaction,HCI,14.00
874,875,Universal Access in the Information Society,UAIS,14.00
875,876,VLSI Design,,14.00
876,877,Discrete Optimization,,14.00
877,878,Ecological Informatics,,14.00
878,879,Swarm Intelligence,,14.00
879,880,Non-Photorealistic Animation and Rendering,NPAR,14.00
880,881,Pacific Symposium on Biocomputing,,14.00
881,882,CLEF (Notebook Papers/LABs/Workshops),,14.00
882,883,"International Conference on Modeling, Analysis and Simulation of Wireless and Mobile Systems",MSWiM,14.00
883,884,International Conference on High Performance Computing,HiPC,14.00
884,885,International Conference on Field-Programmable Technology,FPT,14.00
885,886,International Conference on Information Technology: New Generations,ITNG,14.00
886,887,ACM SIGCOMM Workshop on Hot Topics in Software Defined Networking,HotSDN,14.00
887,888,"International Conference on Embedded Computer Systems: Architectures, Modeling and Simulation",ICSAMOS,14.00
888,889,European Symposium on Algorithms,ESA,14.00
889,890,Affective computing and intelligent interaction,ACII,14.00
890,891,International Conference on Latent Variable Analysis and Source Separation,LVA/ICA,14.00
891,892,Vehicular Networking Conference,VNC,14.00
892,893,VLSI Test Symposium,VTS,14.00
893,894,Conference of the Association for Computational Linguistics,ACL,14.00
894,895,ACM SIGPLAN Symposium on Partial Evaluation and Semantics Based Programming Manipulation,PEPM,14.00
895,896,European conference covering all aspects of parallel and distributed processing,Euro-Par,14.00
896,897,IEEE Congress on Services,SERVICES,14.00
897,898,International conference on network and system security,NSS,14.00
898,899,Asian Conference on Computer Vision,ACCV,14.00
899,900,Asian Conference on Computer Vision,ACCV,14.00
900,901,EUROPEAN CONFERENCE ON MODELLING FOUNDATIONS AND APPLICATIONS,ECMFA,14.00
901,902,Information Assurance and Security,IAS,14.00
902,903,Design Science Research in Information Systems and Technologies,DESRIST,14.00
903,904,IEEE International Conference on Engineering of Complex Computer Systems,ICECCS,14.00
904,905,International symposium on robotics and german conference on robotics,ISR/ROBOTIK,14.00
905,906,Computational Models of Argument,COMMA,14.00
906,907,International Conference on Cloud Computing and Services Science,CLOSER,14.00
907,908,Networking (1),Networking,14.00
908,909,Workshop On Privacy In The Electronic Society,WPES,14.00
909,910,Green Computing Conference,,14.00
910,911,Component-Based Software Engineering,CBSE,14.00
911,912,Network and Operating System Support for Digital Audio and Video,NOSSDAV,14.00
912,913,International Conference on Rewriting Techniques and Applications,RTA,14.00
913,914,International Symposium on Automated Technology for Verification and Analysis,ATVA,14.00
914,915,International Conference on Collaboration Technologies and Systems,CTS,14.00
915,916,GLOBECOM Workshops,,14.00
916,917,Workshop on Internet and Network Economics,WINE,14.00
917,918,,SPSM@CCS,14.00
918,919,Foundations of Software Technologyand Theoretical Computer Science,FSTTCS,14.00
919,920,FLAIRS Conference,,14.00
920,921,International Conference on Automation Science and Engineering,CASE,14.00
921,922,Conference on Image and Video Retrieval,CIVR,14.00
922,923,Wireless and Moble Computing,WiMob,14.00
923,924,International Conference on Pervasive Technologies Related to Assistive Environments,PETRA,14.00
924,925,International Conference on Integer Programming and Combinatorial Optimization,IPCO,14.00
925,926,Algorithm Engineering and Experimentation,ALENEX,14.00
926,927,,WAFR,14.00
927,928,Allerton Conference,,14.00
928,929,,eScience,14.00
929,930,International Conference on Utility and Cloud Computing,UCC,14.00
930,931,DSN Workshops,,14.00
931,932,ACM Web Science,WebSci,14.00
932,933,Computational and Mathematical Methods in Medicine,Comp. Math. Methods in Medicine,14.00
933,934,ACM Transactions on Autonomous and Adaptive Systems,TAAS,14.00
934,935,Annals of Mathematics and Artificial Intelligence,Ann. Math. Artif. Intell.,14.00
935,936,European Journal of Control,Eur. J. Control,14.00
936,937,Journal of Discrete Algorithms,JDA,14.00
937,938,Language and Linguistics Compass,,14.00
938,939,The Journal of Logic and Algebraic Programming,J. Log. Algebr. Program.,14.00
939,940,Internet Research,,14.00
940,941,Journal of Intelligent and Fuzzy Systems,JIFS,14.00
941,942,Journal of Computer Science and Technology,JCST,14.00
942,943,Theory of Computing,,14.00
943,944,Computer Science and Information Systems,ComSIS,14.00
944,945,"Designs, Codes and Cryptography",Des. Codes Cryptography,14.00
945,946,Journal of Artificial Societies and Social Simulation,JASSS,14.00
946,947,ACM Transactions on Design Automation of Electronic Systems,TODAES,14.00
947,948,Natural history museum,NHM,14.00
948,949,ACM Transactions on Computing Education,TOCE,14.00
949,950,Math. Program. Comput.,Math. Program. Comput.,14.00
950,951,International Journal of Foundations of Computer Science,IJFCS,14.00
951,952,Computer Systems Engineering,Eng. Comput. (Lond.),14.00
952,953,Adaptive Behaviour,,14.00
953,954,Algorithms for Molecular Biology,Algorithms Mol Biol,14.00
954,955,Annals of Pure and Applied Logic,Ann. Pure Appl. Logic,14.00
955,956,Journal of Visual Languages and Computing,J. Vis. Lang. Comput.,14.00
956,957,Combinatorica,,13.00
957,958,Computer Communications,CC,13.00
958,959,Artificial Life,,13.00
959,960,Complexity,,13.00
960,961,Integrated Computer-Aided Engineering,ICAE,13.00
961,962,"International Journal of Uncertainty, Fuzziness and Knowledge-Based Systems",,13.00
962,963,Virtual Reality,VR,13.00
963,964,Machine Translation,MT,13.00
964,965,Genetic Programming and Evolvable Machines,GPEM,13.00
965,966,Web Intelligence,WI,13.00
966,967,Mathematical Structures in Computer Science,MSCS,13.00
967,968,Decision Analysis,DECIS ANAL,13.00
968,969,Information and Organization,,13.00
969,970,Computational Biology and Chemistry,,13.00
970,971,Applied Ontology,,13.00
971,972,Theory in Biosciences,THEOR BIOSCI,13.00
972,973,Digital Investigation,,13.00
973,974,International Workshop on Information Forensics and Security,WIFS,13.00
974,975,EDBT/ICDT Workshops,,13.00
975,976,IEEE International Conference on Global Software Engineering,ICGSE,13.00
976,977,International Annual Symposium on Combinatorial Search,SOCS,13.00
977,978,World Haptics,,13.00
978,979,RoboCup Competition and Symposium,RoboCup,13.00
979,980,"International Conference on Computer Safety, Reliability and Security",SAFECOMP,13.00
980,981,ACM Great Lakes Symposium on VLSI,,13.00
981,982,International Joint Conference on Biometrics,ICB,13.00
982,983,,FOSSACS,13.00
983,984,ISoLA (1),ISoLA,13.00
984,985,IFIP International Information Security Conference,SEC,13.00
985,986,International Symposium on Wireless Communications Systems,ISWCS,13.00
986,987,Integrated Network Management,,13.00
987,988,International Conference on Natural Computation,ICNC,13.00
988,989,USENIX Workshop on Hot Topics in Operating Systems,HotOS,13.00
989,990,International Symposium on Memory Management,ISMM,13.00
990,991,Petri Nets,,13.00
991,992,Web Reasoning and Rule Systems,RR,13.00
992,993,,DAGM-Symposium,13.00
993,994,"International Conference on Languages, Compilers, Tools and Theory for Embedded Systems",LCTES,13.00
994,995,INTERACT (2),INTERACT,13.00
995,996,,BMMDS/EMMSAD,13.00
996,997,Engineering Secure Software and Systems,ESSoS,13.00
997,998,Euromicro Symposium on Digital Systems Design,DSD,13.00
998,999,International Conference on Quality Software,QSIC,13.00
999,1000,International Conference on Innovative Mobile and Internet Services in Ubiquitous Computing,IMIS,13.00
