,Rank,Conference,Short Name,H5-Index
441,442,International Conference on Concurrency Theory,CONCUR,21.00
442,443,Requirements Engineering,RE,21.00
443,444,International Workshop on Practice and Theory in Public Key Cryptography,PKC,21.00
444,445,International Conf on Function Programming,ICFP,21.00
445,446,International Conference on Service Oriented Computing,ICSOC,21.00
446,447,ACM Conference on Security and Privacy in Wireless and Mobile Networks,WiSec,21.00
447,448,ACM International Conference on Intelligent User Interfaces,IUI,21.00
448,449,Financial Cryptography,,21.00
449,450,Fundamental Approaches to Software Engineering,FASE,21.00
450,451,International Conference on Medical Image Computing and Computer Assisted Intervention,MICCAI,21.00
451,452,International Conference on Computer-Aided Design,ICCAD,21.00
452,453,,SmartGridComm,21.00
453,454,International Conference on Network Protocols,ICNP,21.00
454,455,IEEE International Symposium on Performance Analysis of Systems and Software,ISPASS,21.00
455,456,"IEEE International Symposium on Personal, Indoor and Mobile Radio Communications",PIMRC,21.00
456,457,The International Conference on Dependable Systems and Networks,DSN,21.00
457,458,Asia and South Pacific Design Automation Conference,ASP-DAC,21.00
458,459,Software Product Lines,SPLC,21.00
459,460,International Conference on Computational Linguistics (Posters),Coling (Poster),21.00
460,461,Journal of Biomedical Semantics,,21.00
461,462,Journal of Computer-Mediated Communication,JCMC,21.00
462,463,Operating Systems Review,SIGOPS,21.00
463,464,Requirements Engineering,Requir. Eng.,21.00
464,465,Journal of Medical Systems,J. Medical Systems,21.00
465,466,Information Retrieval,Inf. Retr.,21.00
466,467,SIAM J. Math. Analysis,SIAM J. Math. Analysis,21.00
467,468,Bioinformatics [ISMB/ECCB],,21.00
468,469,Bioinformatics [ISMB],,21.00
469,470,Journal of Logic and Computation,,21.00
470,471,European Journal of Combinatorics,Eur. J. Comb.,21.00
471,472,"Journal of Combinatorial Theory, Series A","J. Comb. Theory, Ser. A",21.00
472,473,BMC Med. Inf. & Decision Making,,21.00
473,474,Fundamenta Informaticae,Fundam. Inform.,21.00
474,475,Entropy,,21.00
475,476,Journal of Universal Computer Science,J.UCS,21.00
476,477,Computerized Medical Imaging and Graphics,Comp. Med. Imag. and Graph.,21.00
477,478,International Journal of Systems Science,Int. J. Systems Science,21.00
478,479,Journal of Visual Communication and Image Representation,,21.00
479,480,Performance Evaluation,Perform. Eval.,21.00
480,481,SIGMETRICS Performance Evaluation Review,,21.00
481,482,Finance and Stochastics,,21.00
482,483,International Journal of Neural Systems,Int. J. Neural Syst.,21.00
483,484,Journal of Knowledge Management,J. Knowledge Management,21.00
484,485,SIAM Journal on Financial Mathematics,SIFIN,21.00
485,486,International Journal on Software Tools for Technology Transfer,STTT,21.00
486,487,Journal of Intelligent Information Systems,Inf. Syst. J.,21.00
487,488,IEEE Computer Graphics and Applications,CGA,20.00
488,489,Journal of Mathematical Imaging and Vision,JMIV,20.00
489,490,Numerical Algorithms,,20.00
490,491,Language Resources and Evaluation,LRE,20.00
491,492,Journal of Computer Research and Development,,20.00
492,493,International Conference on Computational Science,ICCS,20.00
493,494,ACM Symposium on Principles of Distributed Computing,PODC,20.00
494,495,Advanced Information Networking and Applications,AINA,20.00
495,496,ACM International Conference on Interactive Tabletops and Surfaces,ITS,20.00
496,497,Conference on Information Sciences and Systems,CISS,20.00
497,498,ACM Symposium on Parallelism in Algorithms and Architectures,SPAA,20.00
498,499,Technical Symposium on Computer Science Education,SIGCSE,20.00
499,500,International Symposium on Mixed and Augmented Reality,ISMAR,20.00
500,501,IEEE International Symposium on Biomedical Imaging,ISBI,20.00
501,502,European Semantic Web Conference,ESWC,20.00
502,503,International Conference on Interaction Sciences,ICIS,20.00
503,504,Conference on Empirical Methods on Natural Language Processing and Computational Natural Language Learning,EMNLP-CoNLL,20.00
504,505,International Symposium on Recent Advancesin Intrusion Detection,RAID,20.00
505,506,International Journal of Geographical Information Science,IJGIS,20.00
506,507,International Conference on Future Energy Systems,e-Energy,20.00
507,508,International Conference on Automated Planning and Scheduling,ICAPS,20.00
508,509,European Conference on Artificial Intelligence,ECAI,20.00
509,510,International conference on Humanoid Robots,Humanoids,20.00
510,511,European Symposiumon Research in Computer Security,ESORICS,20.00
511,512,Annual Conference on Computational Learning Theory,COLT,20.00
512,513,IEEE Symposium on Computational Intelligence and Games,CIG,20.00
513,514,ACM International Conference on Ubiquitous Computing,UbiComp,20.00
514,515,Theoretical Informatics and Applications,ITA,20.00
515,516,IEEE International Conference on Program Comprehension,ICPC,20.00
516,517,Computer Security Foundations Symposium,CSF,20.00
517,518,Tangible and Embedded Interaction,TEI,20.00
518,519,Passive and Active Measurement Conference,PAM,20.00
519,520,,SI3D,20.00
520,521,Journal of Heuristics,J. Heuristics,20.00
521,522,"ACM Transactions on Multimedia Computing, Communications and Application",TOMCCAP,20.00
522,523,SIAM Journal of Applied Mathematics,SIAP,20.00
523,524,ACM Transactions on Computer-Human Interaction,TOCHI,20.00
524,525,Theory and Practice of Logic Programming,TPLP,20.00
525,526,International Journal of Communication Systems,IJCS,20.00
526,527,Synthese,,20.00
527,528,International Journal of Intelligent Systems,IJIS,20.00
528,529,IEEE Transactions on Cybernetics,TOC,20.00
529,530,Journal of Automated Reasoning,JAR,20.00
530,531,Signal Processing Systems,SPS,20.00
531,532,Information Processing Letters,Inf. Process. Lett.,20.00
532,533,IEEE Transaction on Haptics,ToH,20.00
533,534,ACM Transactions on Embedded Computing Systems,TECS,20.00
534,535,Computers & Electrical Engineering,CEE,20.00
535,536,ACM Transactions on Knowledge Discovery from Data,TKDD,20.00
536,537,Information Society,,20.00
537,538,Discrete Mathematics,DM,19.00
538,539,Human Factors,HUM FACTORS,19.00
539,540,Biological Cybernetics,,19.00
540,541,Computing in Science and Engineering,C in S&E,19.00
541,542,Wireless Personal Communications,WIREL PERS COMMUN,19.00
542,543,Conference on middleware,Middleware,19.00
543,544,Information Systems Frontiers,ISF,19.00
544,545,ACM/Eurographics Symposium on Computer Animation,SCA,19.00
545,546,Intelligence,,19.00
546,547,Aspect-Oriented Software Development,AOSD,19.00
547,548,International Conference on Parallel Processing,ICPP,19.00
548,549,"IEEE International Conference on Systems, Man, and Cybernetics",SMC,19.00
549,550,"RSA Conference, Cryptographers' Track",CT-RSA,19.00
550,551,Conference on Designing Interactive Systems,,19.00
551,552,"IEEE International Symposium on Modeling, Analysis, and Simulation of Computer and Telecommunication Systems",MASCOTS,19.00
552,553,ACM/IEEE Joint Conference on Digital Libraries,JCDL,19.00
553,554,,ICCPS,19.00
554,555,ACM/IEEE International Symposium on Networks-on-Chip,NOCS,19.00
555,556,Virtual Execution Environments,VEE,19.00
556,557,European Conference on Information Systems,ECIS,19.00
557,558,ACM/SIGDA International Symposium on Field-Programmable Gate Arrays,FPGA,19.00
558,559,International Conference on Medical Image Computing and Computer Assisted Intervention,MICCAI,19.00
559,560,International Symposium on Low Power Electronics and Design,ISLPED,19.00
560,561,International Conference on Hardware/Software Codesign & System Synthesis,CODES+ISSS,19.00
561,562,IEEE Computer Society,IEEE SCC,19.00
562,563,ACM SIGMM International Conference on Multimedia Retrieval,ICMR,19.00
563,564,Advanced Video and Signal Based Surveillance,AVSS,19.00
564,565,Advances in Social Network Analysis and Mining,ASONAM,19.00
565,566,IEEE International Conference on Data Mining Workshops,ICDM Workshops,19.00
566,567,IEEE International Conference on Computer Communications and Networks,ICCCN,19.00
567,568,Theory of Cryptography Conference,TCC,19.00
568,569,IEEE Pacific Visualization Symposium,PacificVis,19.00
569,570,Journal of Computer-Aided Molecular Design,JCAMD,19.00
570,571,Theory of Computing Systems,,19.00
571,572,ACM Transactions on the Web,TWEB,19.00
572,573,International Journal for Computer Assisted Radiology and Surgery,IJCARS,19.00
573,574,The Visual Computer,TVC,19.00
574,575,Electronic Notes in Theoretical Computer Science,entcs,19.00
575,576,ACM Transactions on Information Systems,TOIS,19.00
576,577,Journal of The American Society for Information Science and Technology,JASIS,19.00
577,578,Wireless Communications and Mobile Computing,WCWC,19.00
578,579,IEEE Design & Test of Computers,IEEE D&ToC,19.00
579,580,Artificial Intelligence Review,ARTIF INTELL REV,19.00
580,581,ACM Transactions on Storage,TOS,19.00
581,582,Journal of Grid Computing,JGC,19.00
582,583,IEEE Transactions on Education,ToE,19.00
583,584,Journal of Symbolic Computation,JSC,19.00
584,585,Automated Software Engineering,ASE,19.00
585,586,Mathematics and Computers in Simulation,,18.00
586,587,Real-Time Systems,,18.00
587,588,Winter Simulation Conference,WSC,18.00
588,589,Cluster Computing,CLUSTER,18.00
589,590,Microelectronics Journal,,18.00
590,591,International Symposium on Empirical Software Engineering and Measurement,ESEM,18.00
591,592,International Conference on Research in Computational Molecular Biology,RECOMB,18.00
592,593,USENIX Workshop on Hot Topics in Cloud Computing,HotCloud,18.00
593,594,International Static Analysis Symposium,SAS,18.00
594,595,Virtual Reality,VR,18.00
595,596,International Joint Conference on Biometrics,IJCB,18.00
596,597,IEEE Symposium on Computers and Communications,ISCC,18.00
597,598,Association for Information Systems,AMCIS,18.00
598,599,"International Conference on Verification,Model Checking, and Abstract Interpretation",VMCAI,18.00
599,600,Theory and Applications of Satisfiability Testing,SAT,18.00
600,601,Journal of Computing and Information Technology,CIT,18.00
601,602,IEEE Symposium on Logic in Computer Science,LICS,18.00
602,603,IEEE International Semantic Web Conference,ISWC,18.00
603,604,International Conference on Advanced Information Systems Engineering,CAiSE,18.00
604,605,International Conference on Intelligent Virtual Agents,IVA,18.00
605,606,Conference on Data and Applications Security,CODASPY,18.00
606,607,International Symposium on Software Reliability Engineering,ISSRE,18.00
607,608,European Semantic Web Conference,ESWC,18.00
608,609,Distributed Computing in Sensor Systems,DCOSS,18.00
609,610,International Semantic Web Conference,ISWC,18.00
610,611,Runtime Verification,RV,18.00
611,612,Working Conference on Reverse Engineering,WCRE,18.00
612,613,Workshop on Applications of Computer Vision,WACV,18.00
613,614,IEEE International Conference on Fuzzy Systems,FUZZ-IEEE,18.00
614,615,Fast Software Encryption,FSE,18.00
615,616,IEEE International Conference on P2P Computing,P2P,18.00
616,617,International Conference on Semantic Systems,I-SEMANTICS,18.00
617,618,ACM Transactions on Architecture and Code Optimization,TACO,18.00
618,619,Optimization Methods and Software,OPTIM METHOD SOFTW,18.00
619,620,Journal of Cheminformatics,J CHEMINFORMATICS,18.00
620,621,International Journal on Document Analysis and Recognition,IJDAR,18.00
621,622,Quality and Reliability Engineering International,QREI,18.00
622,623,Applied Intelligence,Appl. Intell.,18.00
623,624,Applied Mathematics and Computer Science,AMCS,18.00
624,625,Journal of Digital Imaging,JDI,18.00
625,626,Journal of Optimization Theory and Applications,JOTA,18.00
626,627,Operations Research Letters,Oper. Res. Lett.,18.00
627,628,Transactions in Gis,T. GIS,18.00
628,629,ACM Transactions on Computer Systems,TOCS,18.00
629,630,ACM Transactions on Mathematical Software,TOMS,18.00
630,631,Technology Analysis & Strategic Management,TASM,18.00
631,632,Journal of Scheduling,,18.00
632,633,SIGKDD Explorations,,18.00
633,634,The Knowledge Engineering Review,Knowledge Eng. Review,18.00
634,635,Multiscale Modeling & Simulation,MULTISCALE MODEL SIMUL,18.00
635,636,Brain Connectivity,,18.00
636,637,Advances in Computational Mathematics,Adv. Comput. Math.,18.00
637,638,Distributed Computing,DC,17.00
638,639,Telematics and Informatics,TELE,17.00
639,640,Computer Standards & Interfaces,CSI,17.00
640,641,Robotica,,17.00
641,642,Computational Intelligence,CI,17.00
642,643,Formal Methods in System Design,FMSD,17.00
643,644,Computer Supported Cooperative Work,CSCW,17.00
644,645,International World Wide Web Conferences,WWW,17.00
645,646,Information Hiding,,17.00
646,647,Multimedia Information Retrieval,MMIR,17.00
647,648,IEEE Transactions on Network and Service Management,TNSM,17.00
648,649,Swarm and Evolutionary Computation,,17.00
649,650,ACM Conference on Supporting Group Work,ASSETS,17.00
650,651,Conference of the European Chapter of the Association for Computational Linguistics,EACL,17.00
651,652,International Conference on Embedded Software,EMSOFT,17.00
652,653,IEEE Workshop on Automatic Speech Recognition and Understanding,ASRU,17.00
653,654,IEEE International Symposium on a World of Wireless Mobile and Multimedia Networks,WoWMoM,17.00
654,655,IEEE PES Innovative Smart Grid Technologies European,ISGT Europe,17.00
655,656,Field-Programmable Custom Computing Machines,FCCM,17.00
656,657,IEEE International Symposium on Robot and Human Interactive Communication,RO-MAN,17.00
657,658,"Modeling and Optimization in Mobile, Ad Hoc, and Wireless Networks",WiOpt,17.00
658,659,Foundations of Digital Games,FDG,17.00
659,660,Extended Semantic Web Conference,ESWC,17.00
660,661,"International Colloquium on Automata, Languages, and Programming",ICALP,17.00
661,662,The European Conference on Machine Learning and Principles and Practice of Knowledge Discovery in Databases,ECML/PKDD,17.00
662,663,The European Conference on Machine Learning and Principles and Practice of Knowledge Discovery in Databases,ECML/PKDD,17.00
663,664,International Conference on Wireless Communications and Mobile Computing,IWCMC,17.00
664,665,International Joint Conference on Natural Language Processing,IJCNLP,17.00
665,666,Conference on Automated Deduction/The International Joint Conference onAutomated Reasoning,CADE/IJCAR,17.00
666,667,Emerging Technologies and Factory Automation,ETFA,17.00
667,668,Field Programmable Logic and Applications,FPL,17.00
668,669,International Conference on Model Driven Engineering Languages and Systems,MoDELS,17.00
669,670,SIGMOD Record,,17.00
670,671,International Symposium on Software Engineering for Adaptive and Self-Managing Systems,SEAMS,17.00
671,672,ACM Symposium on Access Control Modelsand Technologies,SACMAT,17.00
672,673,International Workshop on Mobile Computing Systems and Applications,HotMobile,17.00
673,674,,HT,17.00
674,675,National Forum on Quality Improvement in Health Care,IHI,17.00
675,676,Eye Tracking Research & Application,ETRA,17.00
676,677,Asia-Pacific Network Operations and Management Symposium,NOMS,17.00
677,678,Distributed Event-Based Systems,DEBS,17.00
678,679,German Conference on Artificial Intelligence,KI,17.00
679,680,"Simulation Tools and Techniques for Communications, Networks and Systems",SimuTools,17.00
680,681,International Conference on Parallel Processing Workshops,ICPP workshops,17.00
681,682,International Conference on Machine Learning,ICML,17.00
682,683,International Journal of Digital Earth,Int. J. Digital Earth,17.00
683,684,IEEE Transactions on Autonomous Mental Development,TAMD,17.00
684,685,Java-Informations-Tage,JIT,17.00
685,686,Natural Computing,,17.00
686,687,Journal of Software Maintenance,,17.00
687,688,Journal of Applied Mathematics,,17.00
688,689,Journal of Complexity,,17.00
689,690,ACM Transactions on Multimedia Computing,TOMC,17.00
690,691,"Journal of Combinatorial Theory, Series B","J. Comb. Theory, Ser. B",17.00
691,692,"Combinatorics, Probability & Computing",CPC,17.00
692,693,Scholarpedia,,17.00
693,694,IEICE Transactions,,17.00
694,695,Behaviour & Information Technology,BIT,17.00
695,696,Data Engineering Bulletin Issues,IEEE Data Eng. Bull.,17.00
696,697,International Journal of Human-Computer Interaction,Int. J. Hum. Comput. Interaction,17.00
697,698,Optimization Letters,,17.00
698,699,Journal of Information Science,JIS,17.00
699,700,International Journal of Computer Mathematics,Int. J. Comput. Math.,17.00
700,701,IEEE Journal of Emerging and Selected Topics in Circuits and Systems,IEEE J. Emerg. Sel. Topics Circuits Syst.,17.00
701,702,Formal Aspects of Computing,Formal Asp. Comput.,17.00
702,703,Software Quality Journal,SQJ,17.00
703,704,Interactive Learning Environments,INTERACT LEARN ENVIRON,17.00
704,705,Social Choice and Welfare,SOC CHOICE WELFARE,17.00
705,706,FO & DM,,17.00
706,707,Journal of Computational Science,J. Comput. Science,17.00
707,708,IEEE Computational Intelligence Magazine,CIM,17.00
708,709,Comp. Int. and Neurosc.,,17.00
709,710,AI Magazine,,16.00
710,711,IEEE MultiMedia,,16.00
711,712,Constraints,,16.00
712,713,Information Visualization,IVS,16.00
713,714,Systems Engineering,SYST ENG,16.00
714,715,Statistical Analysis and Data Mining,,16.00
715,716,ACM Symposium on Computational Geometry,SoCG,16.00
716,717,Quantum Information & Computation,QUANTUM INF COMPUT,16.00
717,718,Cognitive Systems Research,,16.00
718,719,CVPR Workshops,,16.00
719,720,ICST Workshops,,16.00
720,721,IEEE Workshop on Spoken Language Technology,SLT,16.00
721,722,Quantitative Evaluation of Systems,QEST,16.00
722,723,ICDE Workshops,,16.00
723,724,International Symposium on Experimental Robotics,ISER,16.00
724,725,International Symposium on Quality Electronic Design,ISQED,16.00
725,726,International Conference on Web Engineering,ICWE,16.00
726,727,International Conference on Database Theory,ICDT,16.00
727,728,ACM International Conference on Multimodal Interaction,ICMI,16.00
728,729,"International Conference on Complex, Intelligent and Software Intensive Systems",CISIS,16.00
729,730,ACM Transactions on Applied Perception,TAP,16.00
730,731,Mobile and Ubiquitous Multimedia,MUM,16.00
731,732,,OM,16.00
732,733,Interaction Design and Children,IDC,16.00
733,734,European Conference on Computer Vision,ECCV,16.00
734,735,ACL (System Demonstrations),,16.00
735,736,Picture Coding Symposium,PCS,16.00
736,737,,PervasiveHealth,16.00
737,738,Nordic Conference on Human-Computer Interaction,NordiCHI,16.00
738,739,,SEA,16.00
739,740,Mass Storage Systems and Technologies,MSST,16.00
740,741,international conference devoted to engineering usable and effective interactive computing systems,EICS,16.00
741,742,ECML/PKDD (1),ECML/PKDD,16.00
742,743,Annual Meeting of the Special Interest Group on Discourse and Dialogue,SIGDIAL Conference,16.00
743,744,International Conference on Conceptual Modeling,ER,16.00
744,745,Document Analysis Systems,DAS,16.00
745,746,Conference on Automated Deduction/The International Joint Conference onAutomated Reasoning,CADE/IJCAR,16.00
746,747,IEEE International Conference on Mobile Ad hoc and Sensor Systems,MASS,16.00
747,748,International Conference on Communication Systems and Networks,COMSNETS,16.00
748,749,Privacy Enhancing Technologies,PETS,16.00
749,750,IEEE International Symposium on Reliable Distributed Systems,SRDS,16.00
750,751,International Conference on Software Engineering,ICSE,16.00
751,752,Usenix Security Symposium,USENIX Security,16.00
752,753,Economics of Information Security,WEIS,16.00
753,754,ACM Cloud Computing Security Workshop,CCSW,16.00
754,755,International Workshop on Quality of Service,IWQoS,16.00
755,756,Formal Method in Computer-Aided Design,FMCAD,16.00
756,757,"Knowledge Acquisition, Modeling and Management",EKAW,16.00
757,758,Allerton,,16.00
758,759,Innovative Smart Grid Technologies Conference,ISGT,16.00
759,760,IEEE Conference on Local Computer Networks,LCN,16.00
760,761,International Conference on Machine Learning,ICML,16.00
761,762,Information Processing in Medical Imaging,IPMI,16.00
762,763,International Working Conference on Advanced User Interfaces,AVI,16.00
763,764,International Conference on Model Transformation,ICMT,16.00
764,765,"Parallel, Distributed and network-based processing",PDP,16.00
765,766,ACM Transactions on Interactive Intelligent Systems,TiiS,16.00
766,767,International Journal of Bio-Inspired Computation,IJBIC,16.00
767,768,International Journal of Social Robotics,I. J. Social Robotics,16.00
768,769,Computational Geometry,Comput. Geom.,16.00
769,770,SIAM Journal on Applied Dynamical Systems,SIADS,16.00
770,771,The Electronic Journal of Combinatorics,Electr. J. Comb.,16.00
771,772,Biosystems,,16.00
772,773,Information Systems and e-Business Management,Inf. Syst. E-Business Management,16.00
773,774,International Journal of Distributed Sensor Networks,IJDSN,16.00
774,775,Journal of Functional Programming,J. Funct. Program.,16.00
775,776,Decision Sciences,DECISION SCI,16.00
776,777,Journal of Networks,JNW,16.00
777,778,Journal of Combinatorial Optimization,J. Comb. Optim.,16.00
778,779,GeoInformatica,,16.00
779,780,International Journal of Sensor Networks,IJSNet,16.00
780,781,International Journal of Biomedical Imaging,Int. J. Biomedical Imaging,16.00
781,782,International Journal of Information Technology and Decision Making,IJITDM,16.00
782,783,Journal of Systems Architecture - Embedded Systems Design,JSA,16.00
783,784,Software Testing Verification & Reliability,STVR,16.00
784,785,Theoretical Computer Science,TCS,15.00
785,786,Computer Aided Geometric Design,CAGD,15.00
786,787,ACM SIGSOFT Software Engineering Notes,SEN,15.00
787,788,Journal of Graph Theory,JGT,15.00
788,789,Selected Areas in Cryptography,SAC,15.00
789,790,Mobile Communications,,15.00
790,791,IT Professional,,15.00
791,792,Natural Language Engineering,NLE,15.00
792,793,Bell Labs Technical Journal,BLTJ,15.00
793,794,Workshop on General Purpose Processing Using GPUs,GPGPU,15.00
794,795,High Performance Graphics,,15.00
795,796,Security and Communication Networks,SCN,15.00
796,797,Annual Reviews in Control,,15.00
797,798,OTM Conferences (1),OTM Conferences,15.00
798,799,Wearable and Implantable Body Sensor Networks,BSN,15.00
799,800,,LDOW,15.00
800,801,International Conference on Mobile Data Management,MDM,15.00
801,802,AINA Workshops,,15.00
802,803,IEEE Communications Society Conference on Sensor and Ad Hoc Communications and Networks,SECON,15.00
803,804,International Conference on Scientific and Statistical DB Management,SSDBM,15.00
804,805,Requirements Engineering: Foundation for Software Quality,REFSQ,15.00
805,806,"Formal Methods, World Congress",FM,15.00
806,807,Intelligent Tutoring Systems (1),Intelligent Tutoring Systems,15.00
807,808,Graphics Interface conference,GI,15.00
808,809,ECCV Workshops (1),ECCV Workshops,15.00
809,810,Artificial Intelligence and Interactive Digital Entertainment Conference,AIIDE,15.00
810,811,IEEE Conference on Visual Analytics Science and Technology,IEEE VAST,15.00
811,812,European conference covering all aspects of parallel and distributed processing,Euro-Par,15.00
812,813,NASA Formal Methods,,15.00
813,814,IEEE International Conference on Semantic Computing,ICSC,15.00
814,815,String Processing and Information Retrieval,SPIRE,15.00
815,816,EvoApplications (1),EvoApplications,15.00
816,817,Trusted Computing - Challenges and Applications,TRUST,15.00
817,818,Rough Sets and Knowledge Technology,RSKT,15.00
818,819,International Conference on Performance Engineering,ICPE,15.00
819,820,Description Logics,DLog,15.00
820,821,International Geoscience and Remote Sensing Symposium,IGARSS,15.00
821,822,Persuasive Technology,PERSUASIVE,15.00
822,823,"International Colloquium on Automata, Languages, and Programming",ICALP,15.00
823,824,International Green Computing Conference,IGCC,15.00
824,825,,ACSCC,15.00
825,826,ICDCS Workshops,,15.00
826,827,,EDOC,15.00
827,828,International Test Conference,ITC,15.00
828,829,International Conference on Frontiers in Handwriting Recognition,ICFHR,15.00
829,830,conference on Interactive Theorem Proving,ITP,15.00
830,831,IEEE Symposium on Visual Languages and Human-Centric Computing,VL/HCC,15.00
831,832,Abdominal Imaging,ABDOM IMAGING,15.00
832,833,International Conference on Principles and Practice of Constraint Programming,CP,15.00
833,834,IEEE International Symposium on Workload Characterization,IISWC,15.00
834,835,Journal of Grid Computing,GRID,15.00
835,836,Variability Modelling of Software-Intensive Systems,VaMoS,15.00
836,837,Multimedia Signal Processing,MMSP,15.00
837,838,"International Conference on availability, reliability and security",ARES,15.00
838,839,Business Process Management Workshops,BPM workshops,15.00
839,840,International Conference on Uncertainty in Artificial Intelligence,UAI,15.00
840,841,IEEE Custom Integrated Circuits Conference,CICC,15.00
841,842,,LION,15.00
842,843,International Conference on Parallel and Distributed Systems,ICPADS,15.00
843,844,International Conference on Parallel Problem Solving from Nature,PPSN,15.00
844,845,The European Conference on Technology Enhanced Learning,EC-TEL,15.00
845,846,The International Symposium on DIStributed Computing,DISC,15.00
846,847,Applied Cryptography and Network Security,ACNS,15.00
847,848,Interactions,,15.00
848,849,AI EDAM,,15.00
849,850,Social Network Analysis and Mining,Social Netw. Analys. Mining,15.00
850,851,ACM Transactions on Modeling and Computer Simulation,TOMACS,15.00
851,852,The ACM Journal on Emerging Technologies in Computing Systems,JETC,15.00
